<?xml version="1.0" encoding="UTF-8"?>

<!DOCTYPE Persons SYSTEM "Person.dtd">
<Persons>
    <Person>
        <Email>s@mail.ru</Email>
        <Nickname>Us1</Nickname>
        <Password>123</Password>
        <Ads>
            <Ad>
                <Description>Квартира в центре</Description>
                <Address>ул.Москвоская, д.22</Address>
                <Floor>2</Floor>
                <Floors>9</Floors>
                <Square>55</Square>
                <Price currency="$$$">77000</Price>

            </Ad>
            <Ad>
                <Description>Квартира возле метро</Description>
                <Address>ул.Одоевского, д.32</Address>
                <Floor>5</Floor>
                <Floors>9</Floors>
                <Square>48</Square>
                <Price currency="$$$">50000</Price>

            </Ad>

        </Ads>
    </Person>

</Persons>
